{
  "bundle_digest": {
    "algorithm": "sha256",
    "encoding": "hex",
    "value": "acfd7fe27d9e905019cf4998d97dceb9c6740c321061965733ad12b880a63631"
  },
  "bundle_id": "bundle_f00_b5438ad283c1",
  "items": [
    {
      "created_at": "2026-10-05T11:30:57.915502Z",
      "criterion_refs": [
        "L9-REQ-FSG-001",
        "L9-REQ-FSG-002",
        "L9-REQ-FSG-003",
        "L9-REQ-FSG-004",
        "L9-REQ-GIT-001",
        "L9-REQ-GIT-002",
        "L9-REQ-GIT-003",
        "L9-REQ-GIT-004",
        "L9-REQ-GIT-005",
        "L9-REQ-GIT-006",
        "L9-REQ-GOV-001",
        "L9-REQ-GOV-002",
        "L9-REQ-GOV-003",
        "L9-REQ-GOV-004",
        "L9-REQ-GOV-005",
        "L9-REQ-GOV-006",
        "L9-REQ-GOV-007",
        "L9-REQ-GOV-008",
        "L9-REQ-IMP-001",
        "L9-REQ-IMP-002",
        "L9-REQ-IMP-003",
        "L9-REQ-IMP-004",
        "L9-REQ-IMP-005",
        "L9-REQ-SEC-001",
        "L9-REQ-SEC-002",
        "L9-REQ-SEC-003",
        "L9-REQ-SEC-004",
        "L9-REQ-SEC-005",
        "L9-REQ-SEC-006"
      ],
      "digest": {
        "algorithm": "sha256",
        "encoding": "hex",
        "value": "ab85f7021fd139f846d643bd91a3965aadc0ed5b0d8b767e81205ced77173fc5"
      },
      "evidence_id": "ev_test_output",
      "media_type": "text/plain",
      "producer": {
        "id": "hermes",
        "principal_type": "EXECUTOR"
      },
      "redaction_status": "NOT_REQUIRED",
      "storage_ref": "review/TEST_OUTPUT.txt",
      "subject_ref": "subject_f00_governance_bootstrap",
      "type": "test_execution"
    },
    {
      "created_at": "2026-10-05T11:30:57.915502Z",
      "criterion_refs": [
        "L9-REQ-FSG-001",
        "L9-REQ-FSG-002",
        "L9-REQ-FSG-003",
        "L9-REQ-FSG-004"
      ],
      "digest": {
        "algorithm": "sha256",
        "encoding": "hex",
        "value": "d08ed7675aaea5bb9c9c8f0ba82834b2f2af4375fff13c9384d83544e310dab9"
      },
      "evidence_id": "ev_root_guard",
      "media_type": "application/json",
      "producer": {
        "id": "hermes",
        "principal_type": "EXECUTOR"
      },
      "redaction_status": "NOT_REQUIRED",
      "storage_ref": "review/ROOT_GUARD_RESULT.json",
      "subject_ref": "subject_f00_governance_bootstrap",
      "type": "root_guard_result"
    }
  ],
  "review_subject_id": "subject_f00_governance_bootstrap",
  "schema_version": "2.0.0"
}
